{"$schema":"https://json-schema.org/draft/2020-12/schema","type":"object","additionalProperties":false,"required":["schema_version","execution_id","shard","rows"],"properties":{"schema_version":{"const":"status-sovereignty-rd04-snap-source-availability-a02-state-shard@3"},"execution_id":{"const":"SSC-RD04-SNAP-A02"},"shard":{"type":"integer","minimum":1,"maximum":5},"rows":{"type":"array","minItems":10,"maxItems":10,"items":{"type":"object","additionalProperties":false,"required":["state","state_name","fixed_search_slots_declared","search_execution_receipts_preserved","search_execution_custody","source_catalogue_scoring_status","search_absence_semantics","dimension_scores","dimension_evidence","state_specific_source_ids","missing_dimensions","not_full_dimensions","total_score"],"properties":{"state":{"type":"string","pattern":"^[A-Z]{2}$"},"state_name":{"type":"string","minLength":1},"fixed_search_slots_declared":{"const":4},"search_execution_receipts_preserved":{"const":0},"search_execution_custody":{"const":"query_and_result_receipts_not_preserved"},"source_catalogue_scoring_status":{"const":"scored_from_recovered_official_source_catalogue"},"search_absence_semantics":{"const":"not_recovered_in_current_catalogue_not_record_absence"},"dimension_scores":{"type":"object","additionalProperties":false,"required":["D1","D2","D3","D4","D5","D6","D7","D8"],"properties":{"D1":{"type":"integer","minimum":0,"maximum":2},"D2":{"type":"integer","minimum":0,"maximum":2},"D3":{"type":"integer","minimum":0,"maximum":2},"D4":{"type":"integer","minimum":0,"maximum":2},"D5":{"type":"integer","minimum":0,"maximum":2},"D6":{"type":"integer","minimum":0,"maximum":2},"D7":{"type":"integer","minimum":0,"maximum":2},"D8":{"type":"integer","minimum":0,"maximum":2}}},"dimension_evidence":{"type":"object","additionalProperties":false,"required":["D1","D2","D3","D4","D5","D6","D7","D8"],"properties":{"D1":{"type":"array","uniqueItems":true,"items":{"type":"string","minLength":1}},"D2":{"type":"array","uniqueItems":true,"items":{"type":"string","minLength":1}},"D3":{"type":"array","uniqueItems":true,"items":{"type":"string","minLength":1}},"D4":{"type":"array","uniqueItems":true,"items":{"type":"string","minLength":1}},"D5":{"type":"array","uniqueItems":true,"items":{"type":"string","minLength":1}},"D6":{"type":"array","uniqueItems":true,"items":{"type":"string","minLength":1}},"D7":{"type":"array","uniqueItems":true,"items":{"type":"string","minLength":1}},"D8":{"type":"array","uniqueItems":true,"items":{"type":"string","minLength":1}}}},"state_specific_source_ids":{"type":"array","uniqueItems":true,"items":{"type":"string","minLength":1}},"missing_dimensions":{"type":"array","uniqueItems":true,"items":{"type":"string","pattern":"^D[1-8]$"}},"not_full_dimensions":{"type":"array","uniqueItems":true,"items":{"type":"string","pattern":"^D[1-8]$"}},"total_score":{"type":"integer","minimum":0,"maximum":16}}}}}}