{"schema_version":"status-sovereignty-rd04-snap-source-availability-a02-state-shard@3","execution_id":"SSC-RD04-SNAP-A02","shard":1,"rows":[{"state":"AL","state_name":"Alabama","fixed_search_slots_declared":4,"search_execution_receipts_preserved":0,"search_execution_custody":"query_and_result_receipts_not_preserved","source_catalogue_scoring_status":"scored_from_recovered_official_source_catalogue","search_absence_semantics":"not_recovered_in_current_catalogue_not_record_absence","dimension_scores":{"D1":1,"D2":1,"D3":1,"D4":0,"D5":0,"D6":0,"D7":0,"D8":1},"dimension_evidence":{"D1":["FNS-OPTIONS"],"D2":["FNS-OPTIONS"],"D3":["FNS-ET-PLANS","FNS-SCREENING"],"D4":[],"D5":[],"D6":[],"D7":[],"D8":["FNS-HOUSEHOLDS"]},"state_specific_source_ids":[],"missing_dimensions":["D4","D5","D6","D7"],"not_full_dimensions":["D1","D2","D3","D4","D5","D6","D7","D8"],"total_score":4},{"state":"AK","state_name":"Alaska","fixed_search_slots_declared":4,"search_execution_receipts_preserved":0,"search_execution_custody":"query_and_result_receipts_not_preserved","source_catalogue_scoring_status":"scored_from_recovered_official_source_catalogue","search_absence_semantics":"not_recovered_in_current_catalogue_not_record_absence","dimension_scores":{"D1":1,"D2":1,"D3":1,"D4":0,"D5":0,"D6":0,"D7":0,"D8":1},"dimension_evidence":{"D1":["FNS-OPTIONS"],"D2":["FNS-OPTIONS"],"D3":["FNS-ET-PLANS","FNS-SCREENING"],"D4":[],"D5":[],"D6":[],"D7":[],"D8":["FNS-HOUSEHOLDS"]},"state_specific_source_ids":[],"missing_dimensions":["D4","D5","D6","D7"],"not_full_dimensions":["D1","D2","D3","D4","D5","D6","D7","D8"],"total_score":4},{"state":"AZ","state_name":"Arizona","fixed_search_slots_declared":4,"search_execution_receipts_preserved":0,"search_execution_custody":"query_and_result_receipts_not_preserved","source_catalogue_scoring_status":"scored_from_recovered_official_source_catalogue","search_absence_semantics":"not_recovered_in_current_catalogue_not_record_absence","dimension_scores":{"D1":1,"D2":1,"D3":1,"D4":0,"D5":1,"D6":2,"D7":0,"D8":1},"dimension_evidence":{"D1":["FNS-OPTIONS"],"D2":["FNS-OPTIONS"],"D3":["FNS-ET-PLANS","FNS-SCREENING"],"D4":[],"D5":["AZ-APPEAL"],"D6":["AZ-APPEAL"],"D7":[],"D8":["FNS-HOUSEHOLDS"]},"state_specific_source_ids":["AZ-APPEAL"],"missing_dimensions":["D4","D7"],"not_full_dimensions":["D1","D2","D3","D4","D5","D7","D8"],"total_score":7},{"state":"AR","state_name":"Arkansas","fixed_search_slots_declared":4,"search_execution_receipts_preserved":0,"search_execution_custody":"query_and_result_receipts_not_preserved","source_catalogue_scoring_status":"scored_from_recovered_official_source_catalogue","search_absence_semantics":"not_recovered_in_current_catalogue_not_record_absence","dimension_scores":{"D1":1,"D2":1,"D3":1,"D4":0,"D5":1,"D6":0,"D7":0,"D8":1},"dimension_evidence":{"D1":["FNS-OPTIONS"],"D2":["FNS-OPTIONS"],"D3":["FNS-ET-PLANS","FNS-SCREENING"],"D4":[],"D5":["AR-APPEAL"],"D6":[],"D7":[],"D8":["FNS-HOUSEHOLDS"]},"state_specific_source_ids":["AR-APPEAL"],"missing_dimensions":["D4","D6","D7"],"not_full_dimensions":["D1","D2","D3","D4","D5","D6","D7","D8"],"total_score":5},{"state":"CA","state_name":"California","fixed_search_slots_declared":4,"search_execution_receipts_preserved":0,"search_execution_custody":"query_and_result_receipts_not_preserved","source_catalogue_scoring_status":"scored_from_recovered_official_source_catalogue","search_absence_semantics":"not_recovered_in_current_catalogue_not_record_absence","dimension_scores":{"D1":2,"D2":2,"D3":2,"D4":0,"D5":1,"D6":2,"D7":2,"D8":1},"dimension_evidence":{"D1":["CA-MANUAL","CA-MANUAL-LETTERS"],"D2":["CA-ABAWD"],"D3":["CA-ABAWD"],"D4":[],"D5":["CA-HEARING"],"D6":["CA-HEARING","CA-RESTORATION"],"D7":["FNS-PILOT"],"D8":["FNS-HOUSEHOLDS"]},"state_specific_source_ids":["CA-ABAWD","CA-HEARING","CA-MANUAL","CA-MANUAL-LETTERS","CA-RESTORATION"],"missing_dimensions":["D4"],"not_full_dimensions":["D4","D5","D8"],"total_score":12},{"state":"CO","state_name":"Colorado","fixed_search_slots_declared":4,"search_execution_receipts_preserved":0,"search_execution_custody":"query_and_result_receipts_not_preserved","source_catalogue_scoring_status":"scored_from_recovered_official_source_catalogue","search_absence_semantics":"not_recovered_in_current_catalogue_not_record_absence","dimension_scores":{"D1":1,"D2":1,"D3":1,"D4":0,"D5":1,"D6":2,"D7":2,"D8":1},"dimension_evidence":{"D1":["FNS-OPTIONS"],"D2":["FNS-OPTIONS"],"D3":["FNS-ET-PLANS","FNS-SCREENING"],"D4":[],"D5":["CO-HEARING"],"D6":["CO-HEARING"],"D7":["FNS-RAPID"],"D8":["FNS-HOUSEHOLDS"]},"state_specific_source_ids":["CO-HEARING"],"missing_dimensions":["D4"],"not_full_dimensions":["D1","D2","D3","D4","D5","D8"],"total_score":9},{"state":"CT","state_name":"Connecticut","fixed_search_slots_declared":4,"search_execution_receipts_preserved":0,"search_execution_custody":"query_and_result_receipts_not_preserved","source_catalogue_scoring_status":"scored_from_recovered_official_source_catalogue","search_absence_semantics":"not_recovered_in_current_catalogue_not_record_absence","dimension_scores":{"D1":2,"D2":2,"D3":2,"D4":0,"D5":1,"D6":2,"D7":2,"D8":1},"dimension_evidence":{"D1":["CT-GENERAL","CT-WORK"],"D2":["CT-EXEMPT"],"D3":["CT-VERIFY"],"D4":[],"D5":["CT-CONTINUED"],"D6":["CT-CONTINUED"],"D7":["FNS-RAPID","FNS-JOBSEARCH"],"D8":["FNS-HOUSEHOLDS"]},"state_specific_source_ids":["CT-CONTINUED","CT-EXEMPT","CT-GENERAL","CT-VERIFY","CT-WORK"],"missing_dimensions":["D4"],"not_full_dimensions":["D4","D5","D8"],"total_score":12},{"state":"DE","state_name":"Delaware","fixed_search_slots_declared":4,"search_execution_receipts_preserved":0,"search_execution_custody":"query_and_result_receipts_not_preserved","source_catalogue_scoring_status":"scored_from_recovered_official_source_catalogue","search_absence_semantics":"not_recovered_in_current_catalogue_not_record_absence","dimension_scores":{"D1":1,"D2":1,"D3":1,"D4":0,"D5":2,"D6":0,"D7":2,"D8":1},"dimension_evidence":{"D1":["FNS-OPTIONS"],"D2":["FNS-OPTIONS"],"D3":["FNS-ET-PLANS","FNS-SCREENING"],"D4":[],"D5":["DE-DECISIONS"],"D6":[],"D7":["FNS-PILOT"],"D8":["FNS-HOUSEHOLDS"]},"state_specific_source_ids":["DE-DECISIONS"],"missing_dimensions":["D4","D6"],"not_full_dimensions":["D1","D2","D3","D4","D6","D8"],"total_score":8},{"state":"FL","state_name":"Florida","fixed_search_slots_declared":4,"search_execution_receipts_preserved":0,"search_execution_custody":"query_and_result_receipts_not_preserved","source_catalogue_scoring_status":"scored_from_recovered_official_source_catalogue","search_absence_semantics":"not_recovered_in_current_catalogue_not_record_absence","dimension_scores":{"D1":1,"D2":1,"D3":1,"D4":0,"D5":1,"D6":0,"D7":0,"D8":1},"dimension_evidence":{"D1":["FNS-OPTIONS"],"D2":["FNS-OPTIONS"],"D3":["FNS-ET-PLANS","FNS-SCREENING"],"D4":[],"D5":["FL-HEARING"],"D6":[],"D7":[],"D8":["FNS-HOUSEHOLDS"]},"state_specific_source_ids":["FL-HEARING"],"missing_dimensions":["D4","D6","D7"],"not_full_dimensions":["D1","D2","D3","D4","D5","D6","D7","D8"],"total_score":5},{"state":"GA","state_name":"Georgia","fixed_search_slots_declared":4,"search_execution_receipts_preserved":0,"search_execution_custody":"query_and_result_receipts_not_preserved","source_catalogue_scoring_status":"scored_from_recovered_official_source_catalogue","search_absence_semantics":"not_recovered_in_current_catalogue_not_record_absence","dimension_scores":{"D1":1,"D2":1,"D3":1,"D4":0,"D5":1,"D6":2,"D7":2,"D8":1},"dimension_evidence":{"D1":["FNS-OPTIONS"],"D2":["FNS-OPTIONS"],"D3":["FNS-ET-PLANS","FNS-SCREENING"],"D4":[],"D5":["GA-FAQ"],"D6":["GA-FAQ"],"D7":["FNS-PILOT"],"D8":["FNS-HOUSEHOLDS"]},"state_specific_source_ids":["GA-FAQ"],"missing_dimensions":["D4"],"not_full_dimensions":["D1","D2","D3","D4","D5","D8"],"total_score":9}]}
